product_id,name,category,subcategory,brand,price,rating,tags,description
4761,PowerMax Storage 9921,Office Supplies,Storage,PowerMax,19626.63,4.1,"travel,kids,outdoor","Lightweight and ergonomic Storage ideal for daily travel, kids, outdoor needs."
4762,Nutrimax Educational 8561 Max,Toys,Educational,Nutrimax,13962.98,4.3,"budget,eco,discount","High-quality Educational from Nutrimax, designed for budget, eco, discount usage."
4763,SoundMax Skincare 6191,Beauty,Skincare,SoundMax,683.05,4.6,"office,fashion,eco","Reliable and durable Skincare suitable for office, fashion, eco."
4764,HomeLite Water Purifier 4872 Lite,Home Appliances,Water Purifier,HomeLite,19854.27,4.4,"bestseller,office,eco","High-quality Water Purifier from HomeLite, designed for bestseller, office, eco usage."
4765,PlayTech Watches 8559 Flex,Fashion,Watches,PlayTech,3628.89,3.8,"gaming,premium,eco","High-quality Watches from PlayTech, designed for gaming, premium, eco usage."
4766,SprintX Comics 580 Max,Books,Comics,SprintX,1478.21,3.7,"premium,budget,fitness",Top-rated Comics known for its long-lasting performance and style.
4767,SoundMax Cookware 3478 Max,Home & Kitchen,Cookware,SoundMax,9836.24,4.6,"premium,student,discount","Feature-rich Cookware crafted for modern premium, student, discount lifestyles."
4768,ToyWorld Storage 457 Go,Office Supplies,Storage,ToyWorld,17081.21,4.3,"student,new,trending",Top-rated Storage known for its long-lasting performance and style.
4769,AirCool Action Figures 4247 Go,Toys,Action Figures,AirCool,7124.07,4.8,"student,trending,office","Reliable and durable Action Figures suitable for student, trending, office."
4770,SoftSilk Cricket 5712 Ultra,Sports,Cricket,SoftSilk,11922.43,4.4,"office,new,outdoor","High-quality Cricket from SoftSilk, designed for office, new, outdoor usage."
4771,WearWell Bike Accessories 5703 Max,Automobile,Bike Accessories,WearWell,1410.46,4.3,"fashion,premium,student","Lightweight and ergonomic Bike Accessories ideal for daily fashion, premium, student needs."
4772,Nutrimax Fitness 4190 Lite,Sports,Fitness,Nutrimax,1041.56,3.9,"kids,discount,bestseller","Reliable and durable Fitness suitable for kids, discount, bestseller."
4773,TechWave Smartwatch 1839 Lite,Wearables,Smartwatch,TechWave,9293.17,5.0,"travel,budget,office","High-quality Smartwatch from TechWave, designed for travel, budget, office usage."
4774,UrbanWalk Haircare 2751 Max,Beauty,Haircare,UrbanWalk,2412.46,4.2,"travel,student,wireless",Top-rated Haircare known for its long-lasting performance and style.
4775,ChefMaster Water Purifier 648 Ultra,Home Appliances,Water Purifier,ChefMaster,7058.52,3.7,"office,new,fashion","High-quality Water Purifier from ChefMaster, designed for office, new, fashion usage."
4776,ToyWorld Washing Machine 1610 Plus,Home Appliances,Washing Machine,ToyWorld,37120.88,3.9,"gaming,portable,wireless","Perfect choice for users looking for a gaming, portable, wireless friendly Washing Machine."
4777,SportX Appliances 8188 Max,Home & Kitchen,Appliances,SportX,9962.19,4.4,"fashion,office,student","Perfect choice for users looking for a fashion, office, student friendly Appliances."
4778,SitRight Desk Accessories 5183 Flex,Office Supplies,Desk Accessories,SitRight,13050.41,3.7,"work,kids,portable","Perfect choice for users looking for a work, kids, portable friendly Desk Accessories."
4779,VeloDrive Bags 3617 Plus,Fashion,Bags,VeloDrive,6701.84,4.9,"budget,bestseller,premium",Top-rated Bags known for its long-lasting performance and style.
4780,SportX Monitor 8171 Plus,Electronics,Monitor,SportX,71556.78,3.7,"fashion,wireless,outdoor","High-quality Monitor from SportX, designed for fashion, wireless, outdoor usage."
4781,AirCool Educational 6528 Plus,Toys,Educational,AirCool,4003.82,4.4,"fashion,discount,outdoor","Feature-rich Educational crafted for modern fashion, discount, outdoor lifestyles."
4782,AirCool Remote Control 4092 Lite,Toys,Remote Control,AirCool,2647.93,4.1,"eco,fashion,kids",Top-rated Remote Control known for its long-lasting performance and style.
4783,FitTrack Stationery 5938 Plus,Office Supplies,Stationery,FitTrack,4193.49,4.2,"fitness,eco,new",Top-rated Stationery known for its long-lasting performance and style.
4784,SportX Self-help 2302 Pro,Books,Self-help,SportX,1745.38,4.6,"fashion,new,portable","Reliable and durable Self-help suitable for fashion, new, portable."
4785,AromaHome Desk Accessories 6837 Pro,Office Supplies,Desk Accessories,AromaHome,7345.54,4.9,"student,work,discount","Feature-rich Desk Accessories crafted for modern student, work, discount lifestyles."
4786,ToyWorld VR Headset 933 Plus,Wearables,VR Headset,ToyWorld,8616.78,4.3,"discount,budget,fashion","Reliable and durable VR Headset suitable for discount, budget, fashion."
4787,AromaHome Tablet 8444 Plus,Electronics,Tablet,AromaHome,48285.36,4.3,"home,outdoor,gaming","Perfect choice for users looking for a home, outdoor, gaming friendly Tablet."
4788,TechWave Car Accessories 2354 Go,Automobile,Car Accessories,TechWave,3884.29,4.6,"wireless,work,discount","Perfect choice for users looking for a wireless, work, discount friendly Car Accessories."
4789,VeloDrive Apparel 5838,Fashion,Apparel,VeloDrive,2357.54,4.3,"portable,bestseller,outdoor","High-quality Apparel from VeloDrive, designed for portable, bestseller, outdoor usage."
4790,SprintX Bike Accessories 8915 Plus,Automobile,Bike Accessories,SprintX,1908.67,4.5,"outdoor,fitness,fashion",Top-rated Bike Accessories known for its long-lasting performance and style.
4791,VeloDrive Snacks 1828 X,Groceries,Snacks,VeloDrive,524.54,4.5,"fashion,premium,kids","Feature-rich Snacks crafted for modern fashion, premium, kids lifestyles."
4792,ToyWorld Watches 1758 Flex,Fashion,Watches,ToyWorld,5596.19,3.7,"budget,work,gaming","Feature-rich Watches crafted for modern budget, work, gaming lifestyles."
4793,HerbalCare Refrigerator 3154 Flex,Home Appliances,Refrigerator,HerbalCare,48481.75,4.3,"fitness,trending,premium","Feature-rich Refrigerator crafted for modern fitness, trending, premium lifestyles."
4794,HomeLite Smartphone 4614,Electronics,Smartphone,HomeLite,24142.81,4.3,"work,home,gaming","Feature-rich Smartphone crafted for modern work, home, gaming lifestyles."
4795,TravelMate Lighting 2611 Plus,Home & Kitchen,Lighting,TravelMate,3224.82,4.3,"eco,bestseller,portable","Feature-rich Lighting crafted for modern eco, bestseller, portable lifestyles."
4796,FitTrack Stationery 9125 Plus,Office Supplies,Stationery,FitTrack,15469.93,3.7,"premium,discount,eco","Perfect choice for users looking for a premium, discount, eco friendly Stationery."
4797,GlowSkin Air Cooler 2398 Ultra,Home Appliances,Air Cooler,GlowSkin,29402.9,3.7,"home,kids,fashion","Feature-rich Air Cooler crafted for modern home, kids, fashion lifestyles."
4798,PlayTech Breakfast 5411 Plus,Groceries,Breakfast,PlayTech,732.9,4.4,"office,travel,bestseller","Feature-rich Breakfast crafted for modern office, travel, bestseller lifestyles."
4799,AirCool Car Accessories 9788 X,Automobile,Car Accessories,AirCool,10804.11,4.5,"premium,eco,fitness","Lightweight and ergonomic Car Accessories ideal for daily premium, eco, fitness needs."
4800,SoftSilk Footwear 8207 Go,Fashion,Footwear,SoftSilk,6716.93,3.7,"gaming,outdoor,travel","Feature-rich Footwear crafted for modern gaming, outdoor, travel lifestyles."
4801,FreshMart Washing Machine 3350,Home Appliances,Washing Machine,FreshMart,31686.77,4.8,"bestseller,fashion,travel","High-quality Washing Machine from FreshMart, designed for bestseller, fashion, travel usage."
4802,VeloDrive Appliances 3968 Pro,Home & Kitchen,Appliances,VeloDrive,8239.59,4.3,"outdoor,discount,new","Perfect choice for users looking for a outdoor, discount, new friendly Appliances."
4803,SprintX Car Accessories 6458 Pro,Automobile,Car Accessories,SprintX,8584.97,4.0,"bestseller,portable,fitness","Feature-rich Car Accessories crafted for modern bestseller, portable, fitness lifestyles."
4804,HomeLite Desk Accessories 6059 Plus,Office Supplies,Desk Accessories,HomeLite,6655.23,4.6,"bestseller,work,premium","Reliable and durable Desk Accessories suitable for bestseller, work, premium."
4805,PowerMax Education 4948 Go,Books,Education,PowerMax,611.09,4.2,"outdoor,travel,fitness","Perfect choice for users looking for a outdoor, travel, fitness friendly Education."
4806,FitTrack Action Figures 6887 Lite,Toys,Action Figures,FitTrack,5428.18,4.1,"kids,portable,eco","High-quality Action Figures from FitTrack, designed for kids, portable, eco usage."
4807,ToyWorld Bike Accessories 1638 Plus,Automobile,Bike Accessories,ToyWorld,8950.5,4.7,"budget,eco,fashion","Feature-rich Bike Accessories crafted for modern budget, eco, fashion lifestyles."
4808,FreshMart Staples 1274 Ultra,Groceries,Staples,FreshMart,997.43,3.8,"trending,work,budget","Lightweight and ergonomic Staples ideal for daily trending, work, budget needs."
4809,EcoServe Appliances 4838 Pro,Home & Kitchen,Appliances,EcoServe,5922.31,4.2,"travel,budget,student","Lightweight and ergonomic Appliances ideal for daily travel, budget, student needs."
4810,VeloDrive Fitness 2404,Sports,Fitness,VeloDrive,2962.15,4.2,"outdoor,budget,wireless",Top-rated Fitness known for its long-lasting performance and style.
4811,PlayTech Desk Accessories 2005 Max,Office Supplies,Desk Accessories,PlayTech,18188.52,4.6,"work,outdoor,trending","Reliable and durable Desk Accessories suitable for work, outdoor, trending."
4812,GlowSkin Makeup 7924 Go,Beauty,Makeup,GlowSkin,742.47,4.4,"kids,eco,new","Feature-rich Makeup crafted for modern kids, eco, new lifestyles."
4813,UrbanWalk Fiction 3750 Flex,Books,Fiction,UrbanWalk,607.09,4.1,"bestseller,work,home","Feature-rich Fiction crafted for modern bestseller, work, home lifestyles."
4814,SoftSilk Cookware 9367 Flex,Home & Kitchen,Cookware,SoftSilk,5950.48,4.6,"fashion,home,wireless","Feature-rich Cookware crafted for modern fashion, home, wireless lifestyles."
4815,ChefPro Furniture 821 Go,Home & Kitchen,Furniture,ChefPro,1397.42,5.0,"fitness,new,trending","Perfect choice for users looking for a fitness, new, trending friendly Furniture."
4816,WearWell Board Game 2800 X,Toys,Board Game,WearWell,11461.36,4.2,"home,gaming,work","Lightweight and ergonomic Board Game ideal for daily home, gaming, work needs."
4817,SoundMax Badminton 396 Ultra,Sports,Badminton,SoundMax,10410.1,4.4,"kids,new,bestseller","Feature-rich Badminton crafted for modern kids, new, bestseller lifestyles."
4818,AromaHome Refrigerator 7833 X,Home Appliances,Refrigerator,AromaHome,37560.88,3.7,"work,gaming,new","Lightweight and ergonomic Refrigerator ideal for daily work, gaming, new needs."
4819,PlayTech Smartwatch 9451 Go,Wearables,Smartwatch,PlayTech,20457.19,4.6,"home,fitness,trending","High-quality Smartwatch from PlayTech, designed for home, fitness, trending usage."
4820,GlowSkin Comics 3882 Plus,Books,Comics,GlowSkin,231.08,3.6,"wireless,home,student","High-quality Comics from GlowSkin, designed for wireless, home, student usage."
4821,AromaHome Watches 274 X,Fashion,Watches,AromaHome,4908.19,4.3,"outdoor,work,bestseller","Lightweight and ergonomic Watches ideal for daily outdoor, work, bestseller needs."
4822,SoundMax Bike Accessories 7565,Automobile,Bike Accessories,SoundMax,1857.84,4.0,"bestseller,work,fitness","Lightweight and ergonomic Bike Accessories ideal for daily bestseller, work, fitness needs."
4823,TravelMate Appliances 6354 X,Home & Kitchen,Appliances,TravelMate,8574.73,3.8,"bestseller,premium,new","Feature-rich Appliances crafted for modern bestseller, premium, new lifestyles."
4824,SoundMax Self-help 6117 Ultra,Books,Self-help,SoundMax,1107.99,3.7,"new,bestseller,eco",Top-rated Self-help known for its long-lasting performance and style.
4825,SportX Desk Accessories 8679 Flex,Office Supplies,Desk Accessories,SportX,4440.44,3.8,"work,student,trending","High-quality Desk Accessories from SportX, designed for work, student, trending usage."
4826,TravelMate Storage 1538 Flex,Office Supplies,Storage,TravelMate,14893.37,3.9,"trending,premium,home","Perfect choice for users looking for a trending, premium, home friendly Storage."
4827,EcoServe Beverages 7599,Groceries,Beverages,EcoServe,469.59,3.9,"bestseller,gaming,office",Top-rated Beverages known for its long-lasting performance and style.
4828,EcoSip Fitness Band 779 Ultra,Wearables,Fitness Band,EcoSip,20536.69,3.6,"discount,budget,trending","High-quality Fitness Band from EcoSip, designed for discount, budget, trending usage."
4829,Skyline Stationery 3245,Office Supplies,Stationery,Skyline,5614.89,4.5,"bestseller,budget,work","Reliable and durable Stationery suitable for bestseller, budget, work."
4830,EcoSip Bike Accessories 2031 Plus,Automobile,Bike Accessories,EcoSip,2801.43,5.0,"portable,eco,discount",Top-rated Bike Accessories known for its long-lasting performance and style.
4831,FitTrack Breakfast 6084 X,Groceries,Breakfast,FitTrack,64.8,4.2,"eco,wireless,fashion","Feature-rich Breakfast crafted for modern eco, wireless, fashion lifestyles."
4832,ToyWorld Refrigerator 6780 Pro,Home Appliances,Refrigerator,ToyWorld,44391.7,5.0,"fashion,portable,office","Lightweight and ergonomic Refrigerator ideal for daily fashion, portable, office needs."
4833,Nutrimax Storage 1090 Ultra,Office Supplies,Storage,Nutrimax,12826.2,4.3,"home,outdoor,trending","Reliable and durable Storage suitable for home, outdoor, trending."
4834,SitRight Eyewear 4278 Go,Fashion,Eyewear,SitRight,2900.74,3.6,"discount,office,outdoor","High-quality Eyewear from SitRight, designed for discount, office, outdoor usage."
4835,SoftSilk Fitness 7568 Plus,Sports,Fitness,SoftSilk,7559.19,4.4,"home,wireless,gaming","Reliable and durable Fitness suitable for home, wireless, gaming."
4836,AromaHome Apparel 3278 Go,Fashion,Apparel,AromaHome,3837.24,4.3,"gaming,home,budget","Reliable and durable Apparel suitable for gaming, home, budget."
4837,WhirlHome Furniture 1885 Ultra,Home & Kitchen,Furniture,WhirlHome,6430.05,4.8,"home,work,portable",Top-rated Furniture known for its long-lasting performance and style.
4838,UrbanWalk Car Accessories 5311 Pro,Automobile,Car Accessories,UrbanWalk,6454.34,4.8,"gaming,outdoor,kids","High-quality Car Accessories from UrbanWalk, designed for gaming, outdoor, kids usage."
4839,AirCool Snacks 8139 Go,Groceries,Snacks,AirCool,261.18,4.5,"gaming,eco,home","Feature-rich Snacks crafted for modern gaming, eco, home lifestyles."
4840,WearWell Comics 4415 X,Books,Comics,WearWell,1481.1,4.7,"portable,student,eco","Perfect choice for users looking for a portable, student, eco friendly Comics."
4841,VeloDrive Washing Machine 3741 Flex,Home Appliances,Washing Machine,VeloDrive,10266.93,3.8,"trending,student,bestseller","Lightweight and ergonomic Washing Machine ideal for daily trending, student, bestseller needs."
4842,ChefPro Board Game 6931 Plus,Toys,Board Game,ChefPro,1801.78,4.2,"eco,outdoor,gaming","High-quality Board Game from ChefPro, designed for eco, outdoor, gaming usage."
4843,HomeLite Bike Accessories 2548,Automobile,Bike Accessories,HomeLite,1707.75,4.5,"home,portable,bestseller","Perfect choice for users looking for a home, portable, bestseller friendly Bike Accessories."
4844,DeskPro Smartwatch 1884 Ultra,Wearables,Smartwatch,DeskPro,3383.57,4.6,"office,eco,work","High-quality Smartwatch from DeskPro, designed for office, eco, work usage."
4845,FreshMart Decor 3693 Max,Home & Kitchen,Decor,FreshMart,994.06,3.6,"travel,fitness,work",Top-rated Decor known for its long-lasting performance and style.
4846,TechWave Beverages 8601 Max,Groceries,Beverages,TechWave,96.17,3.8,"travel,bestseller,outdoor","Perfect choice for users looking for a travel, bestseller, outdoor friendly Beverages."
4847,EcoSip Camera 1197 Lite,Electronics,Camera,EcoSip,9925.94,3.5,"outdoor,trending,eco","High-quality Camera from EcoSip, designed for outdoor, trending, eco usage."
4848,PowerMax Breakfast 5938 Pro,Groceries,Breakfast,PowerMax,579.42,3.9,"portable,fashion,outdoor","Feature-rich Breakfast crafted for modern portable, fashion, outdoor lifestyles."
4849,ToyWorld Breakfast 6484 Flex,Groceries,Breakfast,ToyWorld,596.93,4.5,"discount,trending,gaming",Top-rated Breakfast known for its long-lasting performance and style.
4850,UrbanWalk Smartwatch 1024 X,Wearables,Smartwatch,UrbanWalk,18104.97,4.3,"new,kids,travel",Top-rated Smartwatch known for its long-lasting performance and style.
4851,SprintX Football 1132 Pro,Sports,Football,SprintX,6879.36,5.0,"office,outdoor,home","Perfect choice for users looking for a office, outdoor, home friendly Football."
4852,Skyline Fitness Band 978,Wearables,Fitness Band,Skyline,19548.86,3.7,"kids,wireless,outdoor","Perfect choice for users looking for a kids, wireless, outdoor friendly Fitness Band."
4853,Nutrimax Beverages 1122,Groceries,Beverages,Nutrimax,979.67,4.7,"wireless,kids,work","Lightweight and ergonomic Beverages ideal for daily wireless, kids, work needs."
4854,SoundMax Makeup 1109,Beauty,Makeup,SoundMax,658.31,4.1,"discount,premium,work","High-quality Makeup from SoundMax, designed for discount, premium, work usage."
4855,ChefMaster Eyewear 8486 Go,Fashion,Eyewear,ChefMaster,6855.87,3.7,"bestseller,eco,discount","Perfect choice for users looking for a bestseller, eco, discount friendly Eyewear."
4856,HomeLite Fitness 7459 X,Sports,Fitness,HomeLite,5398.0,3.8,"fitness,trending,discount","Perfect choice for users looking for a fitness, trending, discount friendly Fitness."
4857,WearWell Decor 188,Home & Kitchen,Decor,WearWell,9927.56,4.6,"gaming,discount,student","High-quality Decor from WearWell, designed for gaming, discount, student usage."
4858,VeloDrive Smartphone 2943 Go,Electronics,Smartphone,VeloDrive,85305.84,4.5,"home,discount,portable","Feature-rich Smartphone crafted for modern home, discount, portable lifestyles."
4859,AromaHome Breakfast 6808 Pro,Groceries,Breakfast,AromaHome,773.47,3.6,"premium,office,bestseller","Perfect choice for users looking for a premium, office, bestseller friendly Breakfast."
4860,BookNest Snacks 1319 Flex,Groceries,Snacks,BookNest,797.06,4.7,"kids,budget,fashion","Perfect choice for users looking for a kids, budget, fashion friendly Snacks."
4861,HerbalCare Badminton 563 X,Sports,Badminton,HerbalCare,1924.87,5.0,"new,outdoor,travel","Lightweight and ergonomic Badminton ideal for daily new, outdoor, travel needs."
4862,SprintX Outdoor 6873 X,Sports,Outdoor,SprintX,14386.78,4.9,"kids,budget,premium","Lightweight and ergonomic Outdoor ideal for daily kids, budget, premium needs."
4863,GlowSkin Beverages 3145 Flex,Groceries,Beverages,GlowSkin,143.83,4.0,"portable,home,bestseller","Perfect choice for users looking for a portable, home, bestseller friendly Beverages."
4864,BookNest Remote Control 9799 Pro,Toys,Remote Control,BookNest,11436.73,4.5,"outdoor,bestseller,fitness","Reliable and durable Remote Control suitable for outdoor, bestseller, fitness."
4865,VeloDrive Outdoor 2634 Max,Sports,Outdoor,VeloDrive,5806.76,4.1,"trending,wireless,work","High-quality Outdoor from VeloDrive, designed for trending, wireless, work usage."
4866,DeskPro Skincare 8020 Flex,Beauty,Skincare,DeskPro,2087.35,4.9,"new,travel,office","Reliable and durable Skincare suitable for new, travel, office."
4867,PlayTech Storage 2549 Max,Office Supplies,Storage,PlayTech,3489.6,3.7,"student,fashion,portable","Feature-rich Storage crafted for modern student, fashion, portable lifestyles."
4868,GlowSkin Air Cooler 6247 Go,Home Appliances,Air Cooler,GlowSkin,45472.64,4.6,"home,office,fitness","Lightweight and ergonomic Air Cooler ideal for daily home, office, fitness needs."
4869,PlayTech VR Headset 6063 Plus,Wearables,VR Headset,PlayTech,19934.44,4.3,"fashion,outdoor,premium","Perfect choice for users looking for a fashion, outdoor, premium friendly VR Headset."
4870,EcoSip Storage 7667 X,Office Supplies,Storage,EcoSip,13594.77,4.4,"fitness,wireless,work","Feature-rich Storage crafted for modern fitness, wireless, work lifestyles."
4871,SprintX Football 2328 Flex,Sports,Football,SprintX,9717.34,3.8,"new,gaming,bestseller",Top-rated Football known for its long-lasting performance and style.
4872,SportX Fiction 559 Pro,Books,Fiction,SportX,1248.81,3.7,"eco,portable,budget","Perfect choice for users looking for a eco, portable, budget friendly Fiction."
4873,SportX Care & Cleaning 8646 Go,Automobile,Care & Cleaning,SportX,9517.29,4.4,"student,outdoor,new",Top-rated Care & Cleaning known for its long-lasting performance and style.
4874,SprintX Haircare 1176 Max,Beauty,Haircare,SprintX,291.16,3.7,"bestseller,portable,new",Top-rated Haircare known for its long-lasting performance and style.
4875,SoundMax Appliances 7025 Go,Home & Kitchen,Appliances,SoundMax,4420.05,4.5,"discount,kids,wireless","High-quality Appliances from SoundMax, designed for discount, kids, wireless usage."
4876,TravelMate Fragrance 9360 Max,Beauty,Fragrance,TravelMate,432.94,4.7,"trending,home,wireless",Top-rated Fragrance known for its long-lasting performance and style.
4877,HerbalCare Air Cooler 1923 Ultra,Home Appliances,Air Cooler,HerbalCare,36055.94,3.6,"work,outdoor,kids","Reliable and durable Air Cooler suitable for work, outdoor, kids."
4878,Nutrimax Fragrance 527 Go,Beauty,Fragrance,Nutrimax,1210.29,4.3,"wireless,premium,travel","Perfect choice for users looking for a wireless, premium, travel friendly Fragrance."
4879,ChefMaster Board Game 2796 Flex,Toys,Board Game,ChefMaster,3245.43,4.8,"trending,fashion,student","Perfect choice for users looking for a trending, fashion, student friendly Board Game."
4880,PowerMax Skincare 1377 Max,Beauty,Skincare,PowerMax,411.71,4.0,"student,budget,fashion","Reliable and durable Skincare suitable for student, budget, fashion."
4881,HomeLite Camera 9815,Electronics,Camera,HomeLite,37540.36,4.1,"bestseller,fashion,discount","Lightweight and ergonomic Camera ideal for daily bestseller, fashion, discount needs."
4882,BookNest Decor 5605 Pro,Home & Kitchen,Decor,BookNest,6783.33,3.6,"budget,gaming,student","Perfect choice for users looking for a budget, gaming, student friendly Decor."
4883,UrbanWalk Stationery 1020 X,Office Supplies,Stationery,UrbanWalk,7111.09,4.3,"travel,wireless,student","High-quality Stationery from UrbanWalk, designed for travel, wireless, student usage."
4884,EcoSip Cookware 6915 Go,Home & Kitchen,Cookware,EcoSip,6005.37,4.4,"fitness,eco,work","Lightweight and ergonomic Cookware ideal for daily fitness, eco, work needs."
4885,ChefMaster Appliances 539 Max,Home & Kitchen,Appliances,ChefMaster,1005.68,4.3,"trending,discount,kids","Feature-rich Appliances crafted for modern trending, discount, kids lifestyles."
4886,PowerMax Snacks 3258,Groceries,Snacks,PowerMax,311.67,4.5,"trending,fitness,home","Feature-rich Snacks crafted for modern trending, fitness, home lifestyles."
4887,EcoServe Audio 7817 Flex,Electronics,Audio,EcoServe,2878.54,3.7,"premium,office,fashion","Perfect choice for users looking for a premium, office, fashion friendly Audio."
4888,EcoServe Remote Control 3648 Flex,Toys,Remote Control,EcoServe,4800.36,3.8,"student,outdoor,office","Lightweight and ergonomic Remote Control ideal for daily student, outdoor, office needs."
4889,AirCool Board Game 6796 Lite,Toys,Board Game,AirCool,6222.38,4.3,"bestseller,gaming,travel","Lightweight and ergonomic Board Game ideal for daily bestseller, gaming, travel needs."
4890,Skyline Fitness Band 2182 X,Wearables,Fitness Band,Skyline,16120.18,4.6,"office,portable,fashion","Lightweight and ergonomic Fitness Band ideal for daily office, portable, fashion needs."
4891,SportX Water Purifier 9069 Plus,Home Appliances,Water Purifier,SportX,25862.2,4.1,"eco,trending,gaming","Perfect choice for users looking for a eco, trending, gaming friendly Water Purifier."
4892,HerbalCare Fiction 2476 Ultra,Books,Fiction,HerbalCare,531.92,4.5,"outdoor,work,bestseller","Lightweight and ergonomic Fiction ideal for daily outdoor, work, bestseller needs."
4893,UrbanWalk Fiction 5094 Plus,Books,Fiction,UrbanWalk,1326.08,5.0,"portable,office,bestseller","Reliable and durable Fiction suitable for portable, office, bestseller."
4894,VeloDrive Storage 7643 Ultra,Office Supplies,Storage,VeloDrive,3158.58,3.6,"new,travel,bestseller","Feature-rich Storage crafted for modern new, travel, bestseller lifestyles."
4895,DeskPro Desk Accessories 3103 Flex,Office Supplies,Desk Accessories,DeskPro,9405.54,3.7,"bestseller,office,travel","Reliable and durable Desk Accessories suitable for bestseller, office, travel."
4896,SoftSilk Fitness Band 8244 X,Wearables,Fitness Band,SoftSilk,15259.69,4.9,"bestseller,wireless,trending","Lightweight and ergonomic Fitness Band ideal for daily bestseller, wireless, trending needs."
4897,EcoSip Desk Accessories 5834 Lite,Office Supplies,Desk Accessories,EcoSip,9569.61,4.6,"kids,work,eco","Reliable and durable Desk Accessories suitable for kids, work, eco."
4898,SoundMax Board Game 1177 Ultra,Toys,Board Game,SoundMax,17528.8,4.7,"wireless,home,work",Top-rated Board Game known for its long-lasting performance and style.
4899,SitRight Footwear 1668 Ultra,Fashion,Footwear,SitRight,2545.51,4.4,"portable,gaming,wireless","High-quality Footwear from SitRight, designed for portable, gaming, wireless usage."
4900,EcoServe Football 4263 Ultra,Sports,Football,EcoServe,12292.02,4.7,"premium,bestseller,trending","Perfect choice for users looking for a premium, bestseller, trending friendly Football."
4901,Skyline Education 3554 Lite,Books,Education,Skyline,986.83,3.7,"outdoor,discount,eco",Top-rated Education known for its long-lasting performance and style.
4902,SportX Furniture 9947 Go,Home & Kitchen,Furniture,SportX,3783.03,3.7,"portable,wireless,bestseller","Reliable and durable Furniture suitable for portable, wireless, bestseller."
4903,SoundMax Snacks 2931 Max,Groceries,Snacks,SoundMax,298.16,3.9,"portable,new,travel","Lightweight and ergonomic Snacks ideal for daily portable, new, travel needs."
