product_id,name,category,subcategory,brand,price,rating,tags,description
2157,Skyline Water Purifier 6666 X,Home Appliances,Water Purifier,Skyline,21988.35,4.6,"home,trending,premium","High-quality Water Purifier from Skyline, designed for home, trending, premium usage."
2158,SitRight Water Purifier 5628 Flex,Home Appliances,Water Purifier,SitRight,41302.6,3.6,"fitness,home,office","Lightweight and ergonomic Water Purifier ideal for daily fitness, home, office needs."
2159,Skyline Education 2211 Go,Books,Education,Skyline,1227.25,3.8,"fashion,trending,gaming",Top-rated Education known for its long-lasting performance and style.
2160,AirCool Fitness Band 4079 Lite,Wearables,Fitness Band,AirCool,4131.91,4.2,"wireless,kids,student",Top-rated Fitness Band known for its long-lasting performance and style.
2161,HerbalCare Care & Cleaning 3516 X,Automobile,Care & Cleaning,HerbalCare,7460.45,4.1,"discount,trending,office","Reliable and durable Care & Cleaning suitable for discount, trending, office."
2162,SportX Furniture 4194 Ultra,Home & Kitchen,Furniture,SportX,2696.79,4.7,"outdoor,office,home",Top-rated Furniture known for its long-lasting performance and style.
2163,HomeLite Board Game 318 Flex,Toys,Board Game,HomeLite,17432.61,4.1,"discount,gaming,trending",Top-rated Board Game known for its long-lasting performance and style.
2164,GlowSkin Makeup 9408 Plus,Beauty,Makeup,GlowSkin,2680.85,4.6,"bestseller,fashion,portable",Top-rated Makeup known for its long-lasting performance and style.
2165,AromaHome Desk Accessories 5511 Pro,Office Supplies,Desk Accessories,AromaHome,11247.17,4.2,"travel,budget,kids","Feature-rich Desk Accessories crafted for modern travel, budget, kids lifestyles."
2166,FreshMart Appliances 3587 Ultra,Home & Kitchen,Appliances,FreshMart,9832.74,4.7,"portable,discount,work","High-quality Appliances from FreshMart, designed for portable, discount, work usage."
2167,WhirlHome Lighting 1241 Ultra,Home & Kitchen,Lighting,WhirlHome,9478.27,4.8,"gaming,premium,travel","High-quality Lighting from WhirlHome, designed for gaming, premium, travel usage."
2168,PowerMax Smartwatch 3537 Pro,Wearables,Smartwatch,PowerMax,13323.79,3.7,"trending,kids,fitness",Top-rated Smartwatch known for its long-lasting performance and style.
2169,AirCool Stationery 5659 Flex,Office Supplies,Stationery,AirCool,12370.12,3.8,"outdoor,eco,wireless","Reliable and durable Stationery suitable for outdoor, eco, wireless."
2170,SitRight Bags 7021,Fashion,Bags,SitRight,5196.34,3.7,"eco,fashion,outdoor",Top-rated Bags known for its long-lasting performance and style.
2171,Skyline Bags 385 Go,Fashion,Bags,Skyline,4321.5,5.0,"fashion,travel,budget",Top-rated Bags known for its long-lasting performance and style.
2172,HomeLite Eyewear 1251 Lite,Fashion,Eyewear,HomeLite,1780.17,4.7,"student,premium,bestseller","Feature-rich Eyewear crafted for modern student, premium, bestseller lifestyles."
2173,ChefMaster Fitness Band 6227 Plus,Wearables,Fitness Band,ChefMaster,9470.79,3.6,"fitness,outdoor,travel","High-quality Fitness Band from ChefMaster, designed for fitness, outdoor, travel usage."
2174,GlowSkin Makeup 4271 Lite,Beauty,Makeup,GlowSkin,2904.37,4.8,"new,home,budget","Reliable and durable Makeup suitable for new, home, budget."
2175,HerbalCare Camera 3394 Max,Electronics,Camera,HerbalCare,45501.96,3.8,"portable,budget,kids","High-quality Camera from HerbalCare, designed for portable, budget, kids usage."
2176,WearWell Fragrance 3654 Flex,Beauty,Fragrance,WearWell,517.76,4.5,"student,kids,work","Lightweight and ergonomic Fragrance ideal for daily student, kids, work needs."
2177,PlayTech Apparel 9528 Ultra,Fashion,Apparel,PlayTech,3995.47,3.6,"portable,discount,premium","Lightweight and ergonomic Apparel ideal for daily portable, discount, premium needs."
2178,PlayTech Storage 2885 Ultra,Office Supplies,Storage,PlayTech,5333.05,4.8,"new,fashion,student","Reliable and durable Storage suitable for new, fashion, student."
2179,WearWell Haircare 4560 Flex,Beauty,Haircare,WearWell,1713.25,4.0,"fitness,premium,gaming",Top-rated Haircare known for its long-lasting performance and style.
2180,ToyWorld Fitness Band 7580 Flex,Wearables,Fitness Band,ToyWorld,8543.86,4.9,"eco,home,student",Top-rated Fitness Band known for its long-lasting performance and style.
2181,HerbalCare Storage 5731 Flex,Home & Kitchen,Storage,HerbalCare,5714.4,4.9,"kids,trending,travel","Reliable and durable Storage suitable for kids, trending, travel."
2182,EcoServe Bags 1923 X,Fashion,Bags,EcoServe,472.01,3.5,"fashion,outdoor,trending","High-quality Bags from EcoServe, designed for fashion, outdoor, trending usage."
2183,TechWave Air Cooler 4562 Plus,Home Appliances,Air Cooler,TechWave,14912.8,3.9,"office,student,bestseller","Reliable and durable Air Cooler suitable for office, student, bestseller."
2184,Skyline Board Game 3750,Toys,Board Game,Skyline,18071.42,3.8,"fashion,wireless,new",Top-rated Board Game known for its long-lasting performance and style.
2185,PowerMax Football 9570 Max,Sports,Football,PowerMax,4010.69,3.6,"trending,fashion,home","Reliable and durable Football suitable for trending, fashion, home."
2186,WearWell Badminton 5300 Max,Sports,Badminton,WearWell,10837.68,3.7,"wireless,eco,discount","High-quality Badminton from WearWell, designed for wireless, eco, discount usage."
2187,ChefPro Self-help 4048 Max,Books,Self-help,ChefPro,388.84,4.9,"kids,office,work",Top-rated Self-help known for its long-lasting performance and style.
2188,AromaHome Comics 6911 X,Books,Comics,AromaHome,1826.09,3.9,"fashion,student,travel","Feature-rich Comics crafted for modern fashion, student, travel lifestyles."
2189,AromaHome Snacks 4098 Plus,Groceries,Snacks,AromaHome,221.37,4.7,"fitness,work,student","Reliable and durable Snacks suitable for fitness, work, student."
2190,TechWave Car Accessories 2737 Flex,Automobile,Car Accessories,TechWave,11412.42,3.7,"student,budget,eco","Lightweight and ergonomic Car Accessories ideal for daily student, budget, eco needs."
2191,AromaHome Eyewear 9831 Go,Fashion,Eyewear,AromaHome,3628.97,4.8,"kids,office,premium","Feature-rich Eyewear crafted for modern kids, office, premium lifestyles."
2192,HomeLite Education 9352 Ultra,Books,Education,HomeLite,852.06,4.8,"fashion,outdoor,discount","Lightweight and ergonomic Education ideal for daily fashion, outdoor, discount needs."
2193,WearWell Fitness 9665 Plus,Sports,Fitness,WearWell,491.56,3.6,"budget,gaming,trending","Perfect choice for users looking for a budget, gaming, trending friendly Fitness."
2194,AromaHome Breakfast 2203 Go,Groceries,Breakfast,AromaHome,382.98,4.3,"new,outdoor,kids","Lightweight and ergonomic Breakfast ideal for daily new, outdoor, kids needs."
2195,HerbalCare Smartwatch 8253 Flex,Wearables,Smartwatch,HerbalCare,11656.96,4.5,"travel,budget,bestseller","High-quality Smartwatch from HerbalCare, designed for travel, budget, bestseller usage."
2196,FitTrack Fragrance 4082 X,Beauty,Fragrance,FitTrack,2597.02,4.8,"fitness,portable,eco","Perfect choice for users looking for a fitness, portable, eco friendly Fragrance."
2197,ChefMaster Stationery 6768 Flex,Office Supplies,Stationery,ChefMaster,14785.26,4.6,"new,home,discount","Feature-rich Stationery crafted for modern new, home, discount lifestyles."
2198,SoftSilk Fiction 4247 Ultra,Books,Fiction,SoftSilk,1161.51,3.9,"work,home,trending","Reliable and durable Fiction suitable for work, home, trending."
2199,WhirlHome Printer 3904 Max,Electronics,Printer,WhirlHome,56181.08,4.2,"trending,eco,kids","Perfect choice for users looking for a trending, eco, kids friendly Printer."
2200,EcoServe Fragrance 4151 Lite,Beauty,Fragrance,EcoServe,2935.37,3.9,"gaming,office,premium","Reliable and durable Fragrance suitable for gaming, office, premium."
2201,PowerMax Fragrance 4560 Lite,Beauty,Fragrance,PowerMax,419.75,3.7,"fitness,gaming,bestseller","Perfect choice for users looking for a fitness, gaming, bestseller friendly Fragrance."
2202,WearWell Storage 6753 Flex,Office Supplies,Storage,WearWell,11909.99,4.1,"student,office,home",Top-rated Storage known for its long-lasting performance and style.
2203,TravelMate Car Accessories 6386 Lite,Automobile,Car Accessories,TravelMate,3796.29,3.7,"new,fitness,discount","High-quality Car Accessories from TravelMate, designed for new, fitness, discount usage."
2204,HerbalCare Stationery 8831 Pro,Office Supplies,Stationery,HerbalCare,2982.69,4.3,"home,travel,discount","Lightweight and ergonomic Stationery ideal for daily home, travel, discount needs."
2205,HerbalCare Care & Cleaning 601 X,Automobile,Care & Cleaning,HerbalCare,9651.42,4.3,"new,discount,trending","High-quality Care & Cleaning from HerbalCare, designed for new, discount, trending usage."
2206,BookNest Desk Accessories 6556 Max,Office Supplies,Desk Accessories,BookNest,10970.8,5.0,"office,wireless,eco",Top-rated Desk Accessories known for its long-lasting performance and style.
2207,UrbanWalk Lighting 8374 Lite,Home & Kitchen,Lighting,UrbanWalk,8316.64,4.8,"work,discount,wireless","Lightweight and ergonomic Lighting ideal for daily work, discount, wireless needs."
2208,GlowSkin Water Purifier 1232 Go,Home Appliances,Water Purifier,GlowSkin,9491.41,4.8,"fitness,trending,budget","Reliable and durable Water Purifier suitable for fitness, trending, budget."
2209,ToyWorld Haircare 8190 Max,Beauty,Haircare,ToyWorld,537.73,3.7,"work,portable,student","Lightweight and ergonomic Haircare ideal for daily work, portable, student needs."
2210,ToyWorld Storage 7419 Ultra,Home & Kitchen,Storage,ToyWorld,6345.34,4.9,"home,student,gaming","Feature-rich Storage crafted for modern home, student, gaming lifestyles."
2211,DeskPro Action Figures 5064 Pro,Toys,Action Figures,DeskPro,10980.78,3.6,"outdoor,office,wireless","Feature-rich Action Figures crafted for modern outdoor, office, wireless lifestyles."
2212,EcoServe Education 5716 Max,Books,Education,EcoServe,799.58,3.8,"fashion,portable,trending","Lightweight and ergonomic Education ideal for daily fashion, portable, trending needs."
2213,SprintX Fitness Band 9059 X,Wearables,Fitness Band,SprintX,8207.48,3.7,"new,fitness,discount","Lightweight and ergonomic Fitness Band ideal for daily new, fitness, discount needs."
2214,SoftSilk Furniture 5149 Max,Home & Kitchen,Furniture,SoftSilk,6160.66,4.7,"bestseller,budget,new","Perfect choice for users looking for a bestseller, budget, new friendly Furniture."
2215,SoftSilk Action Figures 2407 X,Toys,Action Figures,SoftSilk,17486.47,3.9,"trending,bestseller,office","Reliable and durable Action Figures suitable for trending, bestseller, office."
2216,ChefPro Staples 8009 X,Groceries,Staples,ChefPro,537.46,3.6,"fitness,portable,budget","Feature-rich Staples crafted for modern fitness, portable, budget lifestyles."
2217,ChefMaster Comics 9701,Books,Comics,ChefMaster,1494.08,4.8,"fitness,budget,bestseller",Top-rated Comics known for its long-lasting performance and style.
2218,Skyline Refrigerator 335 Ultra,Home Appliances,Refrigerator,Skyline,25264.42,4.1,"home,wireless,eco",Top-rated Refrigerator known for its long-lasting performance and style.
2219,Skyline Desk Accessories 6331,Office Supplies,Desk Accessories,Skyline,18698.47,4.6,"wireless,travel,office","Reliable and durable Desk Accessories suitable for wireless, travel, office."
2220,HerbalCare Smartwatch 3782 Max,Wearables,Smartwatch,HerbalCare,11827.01,4.7,"home,budget,gaming","High-quality Smartwatch from HerbalCare, designed for home, budget, gaming usage."
2221,ChefPro Smartwatch 9721 Pro,Wearables,Smartwatch,ChefPro,24737.67,4.4,"wireless,travel,premium","Perfect choice for users looking for a wireless, travel, premium friendly Smartwatch."
2222,TravelMate Board Game 9155 Lite,Toys,Board Game,TravelMate,5924.94,3.5,"fitness,outdoor,work","High-quality Board Game from TravelMate, designed for fitness, outdoor, work usage."
2223,FreshMart Haircare 2343 Go,Beauty,Haircare,FreshMart,426.75,5.0,"gaming,home,kids","High-quality Haircare from FreshMart, designed for gaming, home, kids usage."
2224,Nutrimax Monitor 7704 Go,Electronics,Monitor,Nutrimax,46474.38,4.1,"fashion,wireless,student","Reliable and durable Monitor suitable for fashion, wireless, student."
2225,HerbalCare Car Accessories 8836 Max,Automobile,Car Accessories,HerbalCare,3228.66,4.1,"wireless,student,trending","Lightweight and ergonomic Car Accessories ideal for daily wireless, student, trending needs."
2226,TravelMate Fiction 9725 Flex,Books,Fiction,TravelMate,162.85,4.7,"office,gaming,wireless","High-quality Fiction from TravelMate, designed for office, gaming, wireless usage."
2227,EcoServe Cookware 2363,Home & Kitchen,Cookware,EcoServe,9931.03,4.7,"discount,fitness,eco","Perfect choice for users looking for a discount, fitness, eco friendly Cookware."
2228,PlayTech Football 6766 Max,Sports,Football,PlayTech,8020.95,3.5,"outdoor,work,home","Lightweight and ergonomic Football ideal for daily outdoor, work, home needs."
2229,WearWell Makeup 3679,Beauty,Makeup,WearWell,2760.72,3.9,"new,portable,fashion","Perfect choice for users looking for a new, portable, fashion friendly Makeup."
2230,WhirlHome VR Headset 5165 Ultra,Wearables,VR Headset,WhirlHome,19308.53,3.9,"work,student,kids","Reliable and durable VR Headset suitable for work, student, kids."
2231,SoftSilk Haircare 716 Go,Beauty,Haircare,SoftSilk,1542.46,3.8,"new,eco,home","Feature-rich Haircare crafted for modern new, eco, home lifestyles."
2232,EcoSip Bags 4539 Go,Fashion,Bags,EcoSip,2185.5,3.8,"gaming,eco,travel",Top-rated Bags known for its long-lasting performance and style.
2233,FreshMart Self-help 9845 Ultra,Books,Self-help,FreshMart,1971.08,3.8,"wireless,premium,outdoor","High-quality Self-help from FreshMart, designed for wireless, premium, outdoor usage."
2234,SportX Snacks 723 Go,Groceries,Snacks,SportX,641.03,4.8,"trending,eco,home","Perfect choice for users looking for a trending, eco, home friendly Snacks."
2235,WearWell Fitness 5255 Ultra,Sports,Fitness,WearWell,9097.96,3.9,"trending,budget,portable","Feature-rich Fitness crafted for modern trending, budget, portable lifestyles."
2236,BookNest Watches 7101 Lite,Fashion,Watches,BookNest,4017.23,3.9,"fitness,kids,home","Reliable and durable Watches suitable for fitness, kids, home."
2237,EcoServe Beverages 9523 Go,Groceries,Beverages,EcoServe,971.77,4.1,"outdoor,wireless,fashion","High-quality Beverages from EcoServe, designed for outdoor, wireless, fashion usage."
2238,SportX Furniture 3388,Home & Kitchen,Furniture,SportX,6920.04,4.5,"fashion,new,wireless","Lightweight and ergonomic Furniture ideal for daily fashion, new, wireless needs."
2239,EcoServe Educational 7034 X,Toys,Educational,EcoServe,10150.86,4.4,"student,eco,fitness",Top-rated Educational known for its long-lasting performance and style.
2240,SportX Education 5186 Ultra,Books,Education,SportX,1486.29,3.7,"eco,discount,wireless","Feature-rich Education crafted for modern eco, discount, wireless lifestyles."
2241,HomeLite Fragrance 5171 Pro,Beauty,Fragrance,HomeLite,1965.19,4.7,"travel,office,budget","Feature-rich Fragrance crafted for modern travel, office, budget lifestyles."
2242,HerbalCare Smartwatch 4009,Wearables,Smartwatch,HerbalCare,14197.75,4.1,"wireless,portable,eco","High-quality Smartwatch from HerbalCare, designed for wireless, portable, eco usage."
2243,HerbalCare Air Cooler 5462 Pro,Home Appliances,Air Cooler,HerbalCare,39669.56,4.7,"fashion,work,home","Reliable and durable Air Cooler suitable for fashion, work, home."
2244,Skyline Desk Accessories 9178 X,Office Supplies,Desk Accessories,Skyline,19302.67,3.7,"budget,discount,work","Perfect choice for users looking for a budget, discount, work friendly Desk Accessories."
2245,AirCool Desk Accessories 94 Ultra,Office Supplies,Desk Accessories,AirCool,6044.4,4.8,"student,outdoor,portable",Top-rated Desk Accessories known for its long-lasting performance and style.
2246,PowerMax Cookware 9437 Pro,Home & Kitchen,Cookware,PowerMax,8017.42,4.8,"premium,eco,office","Perfect choice for users looking for a premium, eco, office friendly Cookware."
2247,ChefPro Makeup 5489 Go,Beauty,Makeup,ChefPro,593.15,5.0,"office,student,work","High-quality Makeup from ChefPro, designed for office, student, work usage."
2248,HomeLite Car Accessories 7996 Max,Automobile,Car Accessories,HomeLite,8508.81,3.7,"fitness,eco,budget","High-quality Car Accessories from HomeLite, designed for fitness, eco, budget usage."
2249,GlowSkin Air Cooler 1902 Lite,Home Appliances,Air Cooler,GlowSkin,43724.6,4.0,"wireless,portable,gaming","Lightweight and ergonomic Air Cooler ideal for daily wireless, portable, gaming needs."
2250,SoftSilk Smartwatch 3284 Lite,Wearables,Smartwatch,SoftSilk,15604.71,4.3,"discount,wireless,gaming","Feature-rich Smartwatch crafted for modern discount, wireless, gaming lifestyles."
2251,WhirlHome Cricket 1825 Ultra,Sports,Cricket,WhirlHome,5750.78,4.0,"work,office,travel","Lightweight and ergonomic Cricket ideal for daily work, office, travel needs."
2252,FreshMart Action Figures 7210 Ultra,Toys,Action Figures,FreshMart,4040.06,4.9,"budget,fitness,wireless",Top-rated Action Figures known for its long-lasting performance and style.
2253,FitTrack Snacks 2768,Groceries,Snacks,FitTrack,964.96,3.9,"discount,work,fashion","Feature-rich Snacks crafted for modern discount, work, fashion lifestyles."
2254,SoftSilk Eyewear 777 Ultra,Fashion,Eyewear,SoftSilk,7652.98,3.6,"work,bestseller,wireless",Top-rated Eyewear known for its long-lasting performance and style.
2255,ChefMaster Staples 7648,Groceries,Staples,ChefMaster,922.67,4.4,"portable,discount,bestseller","Lightweight and ergonomic Staples ideal for daily portable, discount, bestseller needs."
2256,HerbalCare Refrigerator 8414,Home Appliances,Refrigerator,HerbalCare,24761.09,4.8,"student,kids,trending","Perfect choice for users looking for a student, kids, trending friendly Refrigerator."
2257,BookNest Educational 8143 Pro,Toys,Educational,BookNest,4880.35,4.3,"new,kids,student","Lightweight and ergonomic Educational ideal for daily new, kids, student needs."
2258,ChefMaster Comics 3999 Go,Books,Comics,ChefMaster,1463.77,4.8,"discount,premium,gaming","Perfect choice for users looking for a discount, premium, gaming friendly Comics."
2259,EcoServe Smartphone 6450 Lite,Electronics,Smartphone,EcoServe,24186.0,4.9,"fitness,budget,travel",Top-rated Smartphone known for its long-lasting performance and style.
2260,WearWell Air Cooler 9078,Home Appliances,Air Cooler,WearWell,38205.39,4.1,"trending,eco,portable","Perfect choice for users looking for a trending, eco, portable friendly Air Cooler."
2261,EcoSip Desk Accessories 8861 Go,Office Supplies,Desk Accessories,EcoSip,7241.76,5.0,"kids,new,office","Feature-rich Desk Accessories crafted for modern kids, new, office lifestyles."
2262,DeskPro Cookware 6470 Ultra,Home & Kitchen,Cookware,DeskPro,7626.68,4.6,"office,trending,eco","Lightweight and ergonomic Cookware ideal for daily office, trending, eco needs."
2263,SportX Storage 8429 Pro,Office Supplies,Storage,SportX,12701.34,4.7,"fitness,home,kids","Lightweight and ergonomic Storage ideal for daily fitness, home, kids needs."
2264,WhirlHome Stationery 1444 Pro,Office Supplies,Stationery,WhirlHome,7378.08,4.0,"budget,discount,bestseller","Reliable and durable Stationery suitable for budget, discount, bestseller."
2265,HomeLite Desk Accessories 1716 X,Office Supplies,Desk Accessories,HomeLite,1575.44,3.7,"budget,home,work","High-quality Desk Accessories from HomeLite, designed for budget, home, work usage."
2266,UrbanWalk Camera 7214 X,Electronics,Camera,UrbanWalk,18322.93,4.0,"discount,fashion,home","High-quality Camera from UrbanWalk, designed for discount, fashion, home usage."
2267,SoftSilk Haircare 8251 Lite,Beauty,Haircare,SoftSilk,1572.51,4.9,"student,discount,wireless","Feature-rich Haircare crafted for modern student, discount, wireless lifestyles."
2268,ChefPro Comics 9652 Plus,Books,Comics,ChefPro,1617.31,4.1,"bestseller,home,travel","High-quality Comics from ChefPro, designed for bestseller, home, travel usage."
2269,UrbanWalk Fragrance 3269,Beauty,Fragrance,UrbanWalk,430.93,3.9,"bestseller,student,new","Lightweight and ergonomic Fragrance ideal for daily bestseller, student, new needs."
2270,TravelMate Storage 2059 Pro,Office Supplies,Storage,TravelMate,17442.95,4.1,"budget,office,portable","Feature-rich Storage crafted for modern budget, office, portable lifestyles."
2271,WhirlHome Self-help 7322 Flex,Books,Self-help,WhirlHome,380.47,4.3,"wireless,fitness,travel","Lightweight and ergonomic Self-help ideal for daily wireless, fitness, travel needs."
2272,FitTrack Stationery 4005 Plus,Office Supplies,Stationery,FitTrack,10033.99,4.8,"trending,premium,budget",Top-rated Stationery known for its long-lasting performance and style.
2273,EcoSip Storage 4568 Ultra,Office Supplies,Storage,EcoSip,9715.24,3.6,"home,trending,bestseller","Feature-rich Storage crafted for modern home, trending, bestseller lifestyles."
2274,ToyWorld Storage 9186 Flex,Office Supplies,Storage,ToyWorld,19884.59,4.4,"discount,travel,bestseller",Top-rated Storage known for its long-lasting performance and style.
2275,Skyline Storage 9830 Ultra,Office Supplies,Storage,Skyline,13033.58,4.6,"work,portable,premium","Lightweight and ergonomic Storage ideal for daily work, portable, premium needs."
2276,SoundMax Cricket 6501 Pro,Sports,Cricket,SoundMax,11115.92,4.8,"bestseller,eco,fashion","Feature-rich Cricket crafted for modern bestseller, eco, fashion lifestyles."
2277,ChefPro Fiction 5245 Ultra,Books,Fiction,ChefPro,1716.93,4.5,"kids,travel,new","High-quality Fiction from ChefPro, designed for kids, travel, new usage."
2278,SportX Smartwatch 2844 Ultra,Wearables,Smartwatch,SportX,14219.89,4.8,"work,office,eco","Feature-rich Smartwatch crafted for modern work, office, eco lifestyles."
2279,FreshMart Haircare 3060 Ultra,Beauty,Haircare,FreshMart,2591.03,4.4,"outdoor,kids,budget",Top-rated Haircare known for its long-lasting performance and style.
2280,HerbalCare Monitor 5754 Max,Electronics,Monitor,HerbalCare,36572.4,3.7,"outdoor,home,premium",Top-rated Monitor known for its long-lasting performance and style.
2281,HerbalCare Air Cooler 6702 X,Home Appliances,Air Cooler,HerbalCare,46383.76,3.5,"eco,premium,trending","Reliable and durable Air Cooler suitable for eco, premium, trending."
2282,ChefMaster Accessories 447 Flex,Electronics,Accessories,ChefMaster,5548.59,4.4,"premium,portable,student","High-quality Accessories from ChefMaster, designed for premium, portable, student usage."
2283,ToyWorld Smartphone 2454 Pro,Electronics,Smartphone,ToyWorld,62230.04,3.9,"fashion,trending,new","High-quality Smartphone from ToyWorld, designed for fashion, trending, new usage."
2284,ChefPro Appliances 749,Home & Kitchen,Appliances,ChefPro,8159.85,3.6,"budget,outdoor,new","High-quality Appliances from ChefPro, designed for budget, outdoor, new usage."
2285,EcoServe Education 5932 Flex,Books,Education,EcoServe,1175.92,3.6,"budget,office,fitness","High-quality Education from EcoServe, designed for budget, office, fitness usage."
2286,AromaHome Tablet 3830 X,Electronics,Tablet,AromaHome,46918.22,4.9,"travel,new,portable","Feature-rich Tablet crafted for modern travel, new, portable lifestyles."
2287,WearWell Staples 7901 Max,Groceries,Staples,WearWell,809.08,4.3,"new,fitness,student","Feature-rich Staples crafted for modern new, fitness, student lifestyles."
2288,ToyWorld Football 8702 Max,Sports,Football,ToyWorld,7939.66,3.9,"gaming,eco,trending","High-quality Football from ToyWorld, designed for gaming, eco, trending usage."
2289,HerbalCare Smartphone 5155 Max,Electronics,Smartphone,HerbalCare,50729.81,4.0,"student,home,fashion","Reliable and durable Smartphone suitable for student, home, fashion."
2290,ChefMaster Fitness Band 8137 Max,Wearables,Fitness Band,ChefMaster,7743.52,4.1,"discount,fitness,outdoor","Lightweight and ergonomic Fitness Band ideal for daily discount, fitness, outdoor needs."
2291,EcoSip Self-help 3849 Plus,Books,Self-help,EcoSip,1193.81,4.5,"fitness,portable,budget","Lightweight and ergonomic Self-help ideal for daily fitness, portable, budget needs."
2292,AirCool Apparel 7516 Ultra,Fashion,Apparel,AirCool,2495.16,4.2,"travel,bestseller,premium","Reliable and durable Apparel suitable for travel, bestseller, premium."
2293,SitRight VR Headset 4510 Pro,Wearables,VR Headset,SitRight,1564.03,4.3,"wireless,travel,student","Reliable and durable VR Headset suitable for wireless, travel, student."
2294,FreshMart Staples 2570 Pro,Groceries,Staples,FreshMart,225.25,4.6,"wireless,home,work",Top-rated Staples known for its long-lasting performance and style.
2295,Skyline Fitness Band 6916 Max,Wearables,Fitness Band,Skyline,11106.81,4.6,"office,gaming,new",Top-rated Fitness Band known for its long-lasting performance and style.
2296,WhirlHome Action Figures 7593 Ultra,Toys,Action Figures,WhirlHome,19400.97,4.6,"fitness,trending,gaming","Lightweight and ergonomic Action Figures ideal for daily fitness, trending, gaming needs."
2297,AromaHome Accessories 8840 Ultra,Electronics,Accessories,AromaHome,2146.16,4.9,"office,trending,student","Perfect choice for users looking for a office, trending, student friendly Accessories."
2298,VeloDrive Breakfast 8084 X,Groceries,Breakfast,VeloDrive,791.6,4.4,"portable,gaming,premium","Lightweight and ergonomic Breakfast ideal for daily portable, gaming, premium needs."
2299,SportX Furniture 605 Lite,Home & Kitchen,Furniture,SportX,1408.94,3.9,"wireless,fitness,student","Feature-rich Furniture crafted for modern wireless, fitness, student lifestyles."
2300,BookNest Staples 404 Pro,Groceries,Staples,BookNest,108.12,4.8,"bestseller,fashion,kids","Lightweight and ergonomic Staples ideal for daily bestseller, fashion, kids needs."
2301,SoftSilk Camera 4163 Lite,Electronics,Camera,SoftSilk,40921.64,3.6,"eco,gaming,student","High-quality Camera from SoftSilk, designed for eco, gaming, student usage."
