product_id,name,category,subcategory,brand,price,rating,tags,description
3461,FitTrack Action Figures 677 Plus,Toys,Action Figures,FitTrack,8879.78,3.9,"student,portable,outdoor","Reliable and durable Action Figures suitable for student, portable, outdoor."
3462,SoftSilk Printer 2168 Go,Electronics,Printer,SoftSilk,43497.31,4.2,"discount,work,budget","Reliable and durable Printer suitable for discount, work, budget."
3463,SprintX Fiction 8393 Pro,Books,Fiction,SprintX,1911.36,3.9,"portable,fitness,fashion","Perfect choice for users looking for a portable, fitness, fashion friendly Fiction."
3464,EcoServe Accessories 7453 Lite,Electronics,Accessories,EcoServe,2929.61,3.7,"work,fitness,new","High-quality Accessories from EcoServe, designed for work, fitness, new usage."
3465,ToyWorld Makeup 4030 Plus,Beauty,Makeup,ToyWorld,446.12,4.3,"fashion,wireless,fitness","Reliable and durable Makeup suitable for fashion, wireless, fitness."
3466,PowerMax Beverages 5270 Lite,Groceries,Beverages,PowerMax,589.52,4.2,"kids,wireless,portable","High-quality Beverages from PowerMax, designed for kids, wireless, portable usage."
3467,TechWave Care & Cleaning 4855 Go,Automobile,Care & Cleaning,TechWave,8624.95,3.8,"new,home,discount","Perfect choice for users looking for a new, home, discount friendly Care & Cleaning."
3468,SoundMax Education 9808,Books,Education,SoundMax,1502.11,4.7,"trending,discount,fashion","High-quality Education from SoundMax, designed for trending, discount, fashion usage."
3469,SoundMax Car Accessories 957 Flex,Automobile,Car Accessories,SoundMax,7958.15,4.9,"outdoor,wireless,premium","High-quality Car Accessories from SoundMax, designed for outdoor, wireless, premium usage."
3470,SprintX Apparel 6993 Go,Fashion,Apparel,SprintX,1719.41,4.9,"bestseller,work,office","Reliable and durable Apparel suitable for bestseller, work, office."
3471,VeloDrive Skincare 4726 Max,Beauty,Skincare,VeloDrive,611.6,5.0,"kids,eco,travel","Perfect choice for users looking for a kids, eco, travel friendly Skincare."
3472,SprintX Snacks 1359 Ultra,Groceries,Snacks,SprintX,574.46,4.2,"portable,premium,bestseller",Top-rated Snacks known for its long-lasting performance and style.
3473,ToyWorld VR Headset 2737 X,Wearables,VR Headset,ToyWorld,6131.82,4.5,"travel,fashion,kids","High-quality VR Headset from ToyWorld, designed for travel, fashion, kids usage."
3474,TechWave Cookware 6238 Flex,Home & Kitchen,Cookware,TechWave,3680.9,4.1,"kids,gaming,bestseller","Lightweight and ergonomic Cookware ideal for daily kids, gaming, bestseller needs."
3475,SportX Bike Accessories 6475 Pro,Automobile,Bike Accessories,SportX,6070.42,3.8,"office,fashion,outdoor","Reliable and durable Bike Accessories suitable for office, fashion, outdoor."
3476,SportX Printer 1247 Go,Electronics,Printer,SportX,38507.25,4.3,"wireless,outdoor,office","Feature-rich Printer crafted for modern wireless, outdoor, office lifestyles."
3477,FreshMart Skincare 3911 Go,Beauty,Skincare,FreshMart,1358.24,4.6,"wireless,gaming,eco","High-quality Skincare from FreshMart, designed for wireless, gaming, eco usage."
3478,EcoServe Smartwatch 6671 Flex,Wearables,Smartwatch,EcoServe,4312.97,4.7,"trending,portable,home","Lightweight and ergonomic Smartwatch ideal for daily trending, portable, home needs."
3479,SoundMax Air Cooler 839 Pro,Home Appliances,Air Cooler,SoundMax,22801.64,4.2,"portable,office,fitness","High-quality Air Cooler from SoundMax, designed for portable, office, fitness usage."
3480,Skyline Outdoor 7521 Max,Sports,Outdoor,Skyline,3865.22,4.9,"work,outdoor,kids",Top-rated Outdoor known for its long-lasting performance and style.
3481,GlowSkin Watches 6691 Go,Fashion,Watches,GlowSkin,665.05,3.7,"home,work,eco","High-quality Watches from GlowSkin, designed for home, work, eco usage."
3482,GlowSkin Washing Machine 7222 Flex,Home Appliances,Washing Machine,GlowSkin,15881.08,4.2,"work,budget,premium",Top-rated Washing Machine known for its long-lasting performance and style.
3483,SoundMax Monitor 704 Max,Electronics,Monitor,SoundMax,62827.97,4.9,"outdoor,budget,wireless","High-quality Monitor from SoundMax, designed for outdoor, budget, wireless usage."
3484,SoundMax Eyewear 5155 Ultra,Fashion,Eyewear,SoundMax,7488.47,4.5,"travel,eco,home","Reliable and durable Eyewear suitable for travel, eco, home."
3485,Skyline Educational 7701 Plus,Toys,Educational,Skyline,256.66,4.2,"portable,travel,premium","Lightweight and ergonomic Educational ideal for daily portable, travel, premium needs."
3486,WearWell Water Purifier 2052 Flex,Home Appliances,Water Purifier,WearWell,48198.69,5.0,"trending,new,discount","High-quality Water Purifier from WearWell, designed for trending, new, discount usage."
3487,SitRight Tablet 7557 Flex,Electronics,Tablet,SitRight,60911.81,3.5,"work,portable,fitness","Perfect choice for users looking for a work, portable, fitness friendly Tablet."
3488,HerbalCare Breakfast 7112 X,Groceries,Breakfast,HerbalCare,172.0,4.5,"gaming,budget,fitness","High-quality Breakfast from HerbalCare, designed for gaming, budget, fitness usage."
3489,Nutrimax Lighting 144 Plus,Home & Kitchen,Lighting,Nutrimax,2860.84,4.0,"fitness,budget,premium","Lightweight and ergonomic Lighting ideal for daily fitness, budget, premium needs."
3490,Nutrimax Haircare 433 Flex,Beauty,Haircare,Nutrimax,1111.34,4.1,"bestseller,home,wireless","Reliable and durable Haircare suitable for bestseller, home, wireless."
3491,Skyline Educational 6865 Go,Toys,Educational,Skyline,7178.82,4.5,"bestseller,trending,fitness","Feature-rich Educational crafted for modern bestseller, trending, fitness lifestyles."
3492,SprintX Remote Control 4055 Plus,Toys,Remote Control,SprintX,9581.76,3.6,"eco,budget,fashion","Perfect choice for users looking for a eco, budget, fashion friendly Remote Control."
3493,TravelMate Snacks 5126 Go,Groceries,Snacks,TravelMate,271.32,3.8,"office,trending,work","High-quality Snacks from TravelMate, designed for office, trending, work usage."
3494,ChefMaster Air Cooler 5137 Lite,Home Appliances,Air Cooler,ChefMaster,11113.6,4.6,"office,portable,kids",Top-rated Air Cooler known for its long-lasting performance and style.
3495,SoundMax Laptop 6079 Lite,Electronics,Laptop,SoundMax,54723.25,4.2,"kids,gaming,wireless",Top-rated Laptop known for its long-lasting performance and style.
3496,SportX Desk Accessories 2362 Plus,Office Supplies,Desk Accessories,SportX,15445.45,4.8,"bestseller,wireless,student","Perfect choice for users looking for a bestseller, wireless, student friendly Desk Accessories."
3497,TechWave Storage 4764 Lite,Home & Kitchen,Storage,TechWave,7970.06,4.8,"kids,new,fashion","Lightweight and ergonomic Storage ideal for daily kids, new, fashion needs."
3498,HomeLite Storage 7306 Ultra,Office Supplies,Storage,HomeLite,16965.49,4.4,"discount,portable,fashion","Lightweight and ergonomic Storage ideal for daily discount, portable, fashion needs."
3499,PowerMax Education 53 Ultra,Books,Education,PowerMax,413.15,4.7,"outdoor,bestseller,work",Top-rated Education known for its long-lasting performance and style.
3500,Skyline Bike Accessories 2540 Ultra,Automobile,Bike Accessories,Skyline,5596.79,4.0,"eco,wireless,new","High-quality Bike Accessories from Skyline, designed for eco, wireless, new usage."
3501,WearWell Apparel 1035 Lite,Fashion,Apparel,WearWell,3160.14,4.1,"fashion,new,work","Lightweight and ergonomic Apparel ideal for daily fashion, new, work needs."
3502,PowerMax Haircare 5114 Lite,Beauty,Haircare,PowerMax,860.11,4.0,"new,travel,discount",Top-rated Haircare known for its long-lasting performance and style.
3503,TechWave Fiction 2113 X,Books,Fiction,TechWave,670.19,4.6,"premium,gaming,eco","Reliable and durable Fiction suitable for premium, gaming, eco."
3504,FitTrack Snacks 2683 Go,Groceries,Snacks,FitTrack,312.66,4.8,"kids,fashion,discount","Reliable and durable Snacks suitable for kids, fashion, discount."
3505,GlowSkin Cookware 3944 Go,Home & Kitchen,Cookware,GlowSkin,3227.67,4.2,"portable,fitness,travel","High-quality Cookware from GlowSkin, designed for portable, fitness, travel usage."
3506,AromaHome Board Game 6134 Max,Toys,Board Game,AromaHome,7361.48,4.4,"fashion,student,trending","High-quality Board Game from AromaHome, designed for fashion, student, trending usage."
3507,ChefMaster Football 7858 X,Sports,Football,ChefMaster,11764.48,4.0,"budget,student,outdoor","Perfect choice for users looking for a budget, student, outdoor friendly Football."
3508,ChefPro Accessories 5709 X,Electronics,Accessories,ChefPro,2925.99,3.5,"eco,travel,discount","Lightweight and ergonomic Accessories ideal for daily eco, travel, discount needs."
3509,PlayTech Accessories 143 Lite,Electronics,Accessories,PlayTech,2012.07,3.7,"home,eco,travel","High-quality Accessories from PlayTech, designed for home, eco, travel usage."
3510,TechWave Fiction 895 Pro,Books,Fiction,TechWave,1407.57,4.0,"portable,eco,work","Reliable and durable Fiction suitable for portable, eco, work."
3511,EcoSip Appliances 5001 Go,Home & Kitchen,Appliances,EcoSip,2574.96,4.8,"budget,work,office","High-quality Appliances from EcoSip, designed for budget, work, office usage."
3512,ToyWorld Education 2010 Lite,Books,Education,ToyWorld,638.82,4.6,"gaming,outdoor,fitness","Perfect choice for users looking for a gaming, outdoor, fitness friendly Education."
3513,SitRight Beverages 9866 Flex,Groceries,Beverages,SitRight,550.03,4.0,"office,kids,student","Reliable and durable Beverages suitable for office, kids, student."
3514,PlayTech Smartwatch 684,Wearables,Smartwatch,PlayTech,24558.83,4.7,"office,home,student","Feature-rich Smartwatch crafted for modern office, home, student lifestyles."
3515,Nutrimax Monitor 8435 Max,Electronics,Monitor,Nutrimax,70221.0,3.9,"travel,trending,eco","Perfect choice for users looking for a travel, trending, eco friendly Monitor."
3516,FreshMart Camera 2762 Go,Electronics,Camera,FreshMart,31980.54,3.9,"gaming,bestseller,office","Lightweight and ergonomic Camera ideal for daily gaming, bestseller, office needs."
3517,ChefMaster Fitness Band 3894 Plus,Wearables,Fitness Band,ChefMaster,6896.07,4.8,"student,outdoor,travel","Feature-rich Fitness Band crafted for modern student, outdoor, travel lifestyles."
3518,PowerMax Stationery 7724 Pro,Office Supplies,Stationery,PowerMax,10062.35,4.2,"office,home,gaming","Feature-rich Stationery crafted for modern office, home, gaming lifestyles."
3519,SportX Storage 1839 Ultra,Home & Kitchen,Storage,SportX,7401.34,4.5,"bestseller,trending,budget",Top-rated Storage known for its long-lasting performance and style.
3520,PowerMax Monitor 5723 Ultra,Electronics,Monitor,PowerMax,28265.68,4.6,"gaming,trending,outdoor","Reliable and durable Monitor suitable for gaming, trending, outdoor."
3521,AromaHome Education 7224 Lite,Books,Education,AromaHome,1195.54,4.9,"kids,premium,wireless","Reliable and durable Education suitable for kids, premium, wireless."
3522,SprintX Appliances 4051,Home & Kitchen,Appliances,SprintX,7443.04,3.5,"gaming,office,travel","Reliable and durable Appliances suitable for gaming, office, travel."
3523,PlayTech Staples 9599 Max,Groceries,Staples,PlayTech,599.23,4.5,"premium,fitness,bestseller","Perfect choice for users looking for a premium, fitness, bestseller friendly Staples."
3524,WearWell Fiction 3132 Ultra,Books,Fiction,WearWell,866.9,4.2,"fashion,kids,premium","Reliable and durable Fiction suitable for fashion, kids, premium."
3525,SprintX Camera 8253 X,Electronics,Camera,SprintX,47442.83,4.1,"student,outdoor,wireless","Feature-rich Camera crafted for modern student, outdoor, wireless lifestyles."
3526,SoundMax Apparel 2353 X,Fashion,Apparel,SoundMax,2547.18,3.7,"travel,trending,home","High-quality Apparel from SoundMax, designed for travel, trending, home usage."
3527,AromaHome Watches 207 Go,Fashion,Watches,AromaHome,7471.65,3.7,"budget,discount,portable",Top-rated Watches known for its long-lasting performance and style.
3528,ChefPro Smartwatch 7035 Pro,Wearables,Smartwatch,ChefPro,6517.02,3.6,"portable,outdoor,bestseller","Lightweight and ergonomic Smartwatch ideal for daily portable, outdoor, bestseller needs."
3529,GlowSkin Board Game 4808,Toys,Board Game,GlowSkin,15443.99,3.9,"trending,wireless,eco","Perfect choice for users looking for a trending, wireless, eco friendly Board Game."
3530,PowerMax Stationery 8628 Pro,Office Supplies,Stationery,PowerMax,17959.63,4.3,"premium,gaming,new",Top-rated Stationery known for its long-lasting performance and style.
3531,TechWave Stationery 8356 Ultra,Office Supplies,Stationery,TechWave,15771.7,3.5,"premium,work,discount","High-quality Stationery from TechWave, designed for premium, work, discount usage."
3532,TechWave Haircare 8841 Pro,Beauty,Haircare,TechWave,868.92,4.8,"fitness,portable,student","Reliable and durable Haircare suitable for fitness, portable, student."
3533,FreshMart Car Accessories 9512 Lite,Automobile,Car Accessories,FreshMart,733.54,4.9,"work,student,gaming","Feature-rich Car Accessories crafted for modern work, student, gaming lifestyles."
3534,SportX Fragrance 3532 X,Beauty,Fragrance,SportX,1077.33,3.7,"trending,kids,discount","Perfect choice for users looking for a trending, kids, discount friendly Fragrance."
3535,SportX Water Purifier 7677 Plus,Home Appliances,Water Purifier,SportX,44198.12,4.0,"outdoor,bestseller,discount","High-quality Water Purifier from SportX, designed for outdoor, bestseller, discount usage."
3536,WearWell Fiction 5382,Books,Fiction,WearWell,1241.73,4.8,"fitness,wireless,new","Perfect choice for users looking for a fitness, wireless, new friendly Fiction."
3537,DeskPro Fitness Band 1854 Go,Wearables,Fitness Band,DeskPro,14305.27,4.9,"wireless,student,office",Top-rated Fitness Band known for its long-lasting performance and style.
3538,ChefPro Fitness 2635 Flex,Sports,Fitness,ChefPro,4526.78,3.6,"portable,student,fashion","Perfect choice for users looking for a portable, student, fashion friendly Fitness."
3539,Skyline Apparel 8165 Lite,Fashion,Apparel,Skyline,3634.96,4.7,"bestseller,fitness,budget","Reliable and durable Apparel suitable for bestseller, fitness, budget."
3540,WhirlHome Desk Accessories 22 Go,Office Supplies,Desk Accessories,WhirlHome,11713.12,4.9,"kids,office,discount","Reliable and durable Desk Accessories suitable for kids, office, discount."
3541,TravelMate Water Purifier 5346 Pro,Home Appliances,Water Purifier,TravelMate,31167.01,4.6,"gaming,trending,budget","Reliable and durable Water Purifier suitable for gaming, trending, budget."
3542,Skyline Action Figures 4699 Ultra,Toys,Action Figures,Skyline,2319.71,5.0,"fitness,fashion,bestseller","High-quality Action Figures from Skyline, designed for fitness, fashion, bestseller usage."
3543,AromaHome Eyewear 7530 Pro,Fashion,Eyewear,AromaHome,6601.95,4.9,"trending,home,premium","Reliable and durable Eyewear suitable for trending, home, premium."
3544,SoftSilk Staples 6773 Pro,Groceries,Staples,SoftSilk,517.92,4.3,"eco,wireless,outdoor","Feature-rich Staples crafted for modern eco, wireless, outdoor lifestyles."
3545,SprintX Furniture 5772 X,Home & Kitchen,Furniture,SprintX,8766.5,4.1,"work,outdoor,kids","High-quality Furniture from SprintX, designed for work, outdoor, kids usage."
3546,EcoServe Decor 9578 Max,Home & Kitchen,Decor,EcoServe,2042.12,3.6,"fitness,discount,bestseller","Perfect choice for users looking for a fitness, discount, bestseller friendly Decor."
3547,HomeLite Storage 2411 Max,Office Supplies,Storage,HomeLite,17866.15,4.2,"eco,budget,office","High-quality Storage from HomeLite, designed for eco, budget, office usage."
3548,Skyline Fitness Band 4852 Ultra,Wearables,Fitness Band,Skyline,6888.29,3.7,"gaming,new,kids","High-quality Fitness Band from Skyline, designed for gaming, new, kids usage."
3549,SportX Eyewear 8275,Fashion,Eyewear,SportX,3671.37,4.5,"kids,work,office",Top-rated Eyewear known for its long-lasting performance and style.
3550,WearWell Care & Cleaning 5085 Go,Automobile,Care & Cleaning,WearWell,8619.5,4.2,"premium,work,discount","High-quality Care & Cleaning from WearWell, designed for premium, work, discount usage."
3551,SitRight Staples 7550 Pro,Groceries,Staples,SitRight,943.28,4.2,"work,eco,budget","Lightweight and ergonomic Staples ideal for daily work, eco, budget needs."
3552,SprintX Self-help 8872 Go,Books,Self-help,SprintX,1102.0,3.6,"student,new,discount","Lightweight and ergonomic Self-help ideal for daily student, new, discount needs."
3553,SoftSilk Fitness 5381 Go,Sports,Fitness,SoftSilk,10528.06,4.9,"fashion,trending,eco","Perfect choice for users looking for a fashion, trending, eco friendly Fitness."
3554,ChefMaster Tablet 5385 Pro,Electronics,Tablet,ChefMaster,57873.54,4.4,"fashion,trending,premium",Top-rated Tablet known for its long-lasting performance and style.
3555,PowerMax Storage 4398 Max,Office Supplies,Storage,PowerMax,16983.37,4.1,"premium,office,budget","Reliable and durable Storage suitable for premium, office, budget."
3556,TravelMate Watches 6036 X,Fashion,Watches,TravelMate,4236.86,4.5,"student,trending,office","Lightweight and ergonomic Watches ideal for daily student, trending, office needs."
3557,FitTrack Cricket 7431,Sports,Cricket,FitTrack,11305.1,4.3,"bestseller,student,travel",Top-rated Cricket known for its long-lasting performance and style.
3558,TravelMate Cricket 3314 Ultra,Sports,Cricket,TravelMate,9126.53,4.3,"wireless,portable,fitness","High-quality Cricket from TravelMate, designed for wireless, portable, fitness usage."
3559,SprintX Care & Cleaning 9351,Automobile,Care & Cleaning,SprintX,8651.39,3.5,"new,student,fashion","Lightweight and ergonomic Care & Cleaning ideal for daily new, student, fashion needs."
3560,EcoServe Footwear 3409 Lite,Fashion,Footwear,EcoServe,3235.4,5.0,"home,wireless,work",Top-rated Footwear known for its long-lasting performance and style.
3561,EcoSip Educational 1139 Lite,Toys,Educational,EcoSip,18455.89,4.3,"premium,fitness,budget","Reliable and durable Educational suitable for premium, fitness, budget."
3562,SprintX Care & Cleaning 7708 Plus,Automobile,Care & Cleaning,SprintX,8340.82,4.3,"fitness,kids,trending","High-quality Care & Cleaning from SprintX, designed for fitness, kids, trending usage."
3563,ChefMaster Fitness 8425,Sports,Fitness,ChefMaster,6740.79,5.0,"discount,premium,fashion","High-quality Fitness from ChefMaster, designed for discount, premium, fashion usage."
3564,SportX VR Headset 739 Go,Wearables,VR Headset,SportX,10110.46,4.8,"kids,bestseller,gaming","Perfect choice for users looking for a kids, bestseller, gaming friendly VR Headset."
3565,SprintX Staples 3044 Plus,Groceries,Staples,SprintX,316.61,4.6,"fitness,discount,travel",Top-rated Staples known for its long-lasting performance and style.
3566,BookNest Car Accessories 5370 Plus,Automobile,Car Accessories,BookNest,10297.72,4.9,"home,budget,fitness","Feature-rich Car Accessories crafted for modern home, budget, fitness lifestyles."
3567,AromaHome Eyewear 1434 Ultra,Fashion,Eyewear,AromaHome,5089.97,3.6,"bestseller,kids,outdoor",Top-rated Eyewear known for its long-lasting performance and style.
3568,EcoSip Watches 7170 Plus,Fashion,Watches,EcoSip,3501.7,4.5,"bestseller,eco,outdoor","High-quality Watches from EcoSip, designed for bestseller, eco, outdoor usage."
3569,SoundMax Lighting 9273 Ultra,Home & Kitchen,Lighting,SoundMax,491.28,4.8,"kids,work,new","Reliable and durable Lighting suitable for kids, work, new."
3570,FitTrack Makeup 2965 Go,Beauty,Makeup,FitTrack,335.7,4.1,"fashion,kids,discount","Lightweight and ergonomic Makeup ideal for daily fashion, kids, discount needs."
3571,SitRight Storage 9195,Home & Kitchen,Storage,SitRight,9313.01,3.7,"outdoor,wireless,student","High-quality Storage from SitRight, designed for outdoor, wireless, student usage."
3572,SitRight Footwear 9270 X,Fashion,Footwear,SitRight,1034.8,3.6,"office,budget,fitness","Lightweight and ergonomic Footwear ideal for daily office, budget, fitness needs."
3573,Skyline Bike Accessories 6114 Ultra,Automobile,Bike Accessories,Skyline,3112.94,3.8,"fitness,work,discount","Reliable and durable Bike Accessories suitable for fitness, work, discount."
3574,Nutrimax Fiction 6125 Ultra,Books,Fiction,Nutrimax,754.34,3.8,"new,home,fashion","Feature-rich Fiction crafted for modern new, home, fashion lifestyles."
3575,FreshMart Fitness 3772 X,Sports,Fitness,FreshMart,11387.54,4.0,"gaming,office,discount","Lightweight and ergonomic Fitness ideal for daily gaming, office, discount needs."
3576,GlowSkin Fitness 4029 Pro,Sports,Fitness,GlowSkin,13507.5,3.9,"wireless,new,work","Perfect choice for users looking for a wireless, new, work friendly Fitness."
3577,FitTrack Badminton 9402 Pro,Sports,Badminton,FitTrack,6128.44,4.0,"eco,outdoor,premium","Reliable and durable Badminton suitable for eco, outdoor, premium."
3578,HomeLite Board Game 6273 Lite,Toys,Board Game,HomeLite,16243.32,4.5,"student,work,premium","Lightweight and ergonomic Board Game ideal for daily student, work, premium needs."
3579,SprintX Self-help 2798 Lite,Books,Self-help,SprintX,1822.8,3.6,"premium,travel,budget","High-quality Self-help from SprintX, designed for premium, travel, budget usage."
3580,ToyWorld Board Game 830 Lite,Toys,Board Game,ToyWorld,7747.48,3.8,"premium,discount,travel","Feature-rich Board Game crafted for modern premium, discount, travel lifestyles."
3581,SportX Desk Accessories 5307,Office Supplies,Desk Accessories,SportX,11123.39,4.2,"portable,budget,student","Feature-rich Desk Accessories crafted for modern portable, budget, student lifestyles."
3582,HerbalCare Smartphone 5225 Flex,Electronics,Smartphone,HerbalCare,80352.67,4.6,"discount,travel,trending","Lightweight and ergonomic Smartphone ideal for daily discount, travel, trending needs."
3583,SoundMax Eyewear 796 Go,Fashion,Eyewear,SoundMax,2131.8,4.4,"fitness,discount,work","High-quality Eyewear from SoundMax, designed for fitness, discount, work usage."
3584,GlowSkin Accessories 2296 Pro,Electronics,Accessories,GlowSkin,5488.16,4.0,"home,fitness,eco","Feature-rich Accessories crafted for modern home, fitness, eco lifestyles."
3585,Nutrimax Desk Accessories 8325 X,Office Supplies,Desk Accessories,Nutrimax,7268.38,3.5,"discount,trending,student",Top-rated Desk Accessories known for its long-lasting performance and style.
3586,BookNest Skincare 3559,Beauty,Skincare,BookNest,1498.69,4.1,"outdoor,fitness,gaming","Feature-rich Skincare crafted for modern outdoor, fitness, gaming lifestyles."
3587,EcoSip Bags 4826 X,Fashion,Bags,EcoSip,5668.91,4.6,"eco,fitness,office",Top-rated Bags known for its long-lasting performance and style.
3588,AromaHome Cookware 6399 Max,Home & Kitchen,Cookware,AromaHome,5823.0,3.9,"budget,outdoor,trending","Lightweight and ergonomic Cookware ideal for daily budget, outdoor, trending needs."
3589,PowerMax Care & Cleaning 9783 Lite,Automobile,Care & Cleaning,PowerMax,4275.24,4.5,"trending,kids,wireless","High-quality Care & Cleaning from PowerMax, designed for trending, kids, wireless usage."
3590,TechWave Desk Accessories 5736 Plus,Office Supplies,Desk Accessories,TechWave,7936.15,4.2,"outdoor,travel,student","Feature-rich Desk Accessories crafted for modern outdoor, travel, student lifestyles."
3591,ChefMaster Stationery 2398 Pro,Office Supplies,Stationery,ChefMaster,7948.03,3.6,"fitness,discount,work","Reliable and durable Stationery suitable for fitness, discount, work."
3592,DeskPro Badminton 3054 Go,Sports,Badminton,DeskPro,8612.67,4.2,"office,eco,discount","Reliable and durable Badminton suitable for office, eco, discount."
3593,ChefMaster Apparel 4901,Fashion,Apparel,ChefMaster,554.15,3.6,"fashion,fitness,wireless","Feature-rich Apparel crafted for modern fashion, fitness, wireless lifestyles."
3594,FitTrack Action Figures 2689 Ultra,Toys,Action Figures,FitTrack,15515.23,5.0,"work,outdoor,new","Perfect choice for users looking for a work, outdoor, new friendly Action Figures."
3595,ChefPro Stationery 4563 Ultra,Office Supplies,Stationery,ChefPro,13743.99,4.9,"office,travel,student","Reliable and durable Stationery suitable for office, travel, student."
3596,TravelMate Appliances 8767 X,Home & Kitchen,Appliances,TravelMate,1283.82,4.9,"fashion,kids,outdoor","Feature-rich Appliances crafted for modern fashion, kids, outdoor lifestyles."
3597,GlowSkin Fitness 2471 Lite,Sports,Fitness,GlowSkin,2616.24,3.6,"office,gaming,home","High-quality Fitness from GlowSkin, designed for office, gaming, home usage."
3598,HerbalCare Action Figures 9836 Go,Toys,Action Figures,HerbalCare,15912.25,5.0,"discount,gaming,fitness","Perfect choice for users looking for a discount, gaming, fitness friendly Action Figures."
3599,PlayTech Stationery 2004 Plus,Office Supplies,Stationery,PlayTech,17984.34,3.6,"work,trending,premium","Lightweight and ergonomic Stationery ideal for daily work, trending, premium needs."
3600,ChefPro Beverages 5988,Groceries,Beverages,ChefPro,465.07,4.6,"gaming,office,trending","Reliable and durable Beverages suitable for gaming, office, trending."
3601,WearWell Board Game 3381 Flex,Toys,Board Game,WearWell,1515.8,4.7,"portable,home,bestseller","Lightweight and ergonomic Board Game ideal for daily portable, home, bestseller needs."
3602,AromaHome Footwear 5480 Pro,Fashion,Footwear,AromaHome,2667.84,4.8,"outdoor,budget,work","Reliable and durable Footwear suitable for outdoor, budget, work."
3603,WearWell Washing Machine 1461 Flex,Home Appliances,Washing Machine,WearWell,24238.6,3.5,"office,premium,student","Feature-rich Washing Machine crafted for modern office, premium, student lifestyles."
3604,FreshMart Care & Cleaning 7429 Lite,Automobile,Care & Cleaning,FreshMart,2003.14,3.5,"bestseller,work,premium",Top-rated Care & Cleaning known for its long-lasting performance and style.
3605,WearWell Fitness Band 2041 Max,Wearables,Fitness Band,WearWell,15668.7,3.7,"office,gaming,eco","Reliable and durable Fitness Band suitable for office, gaming, eco."
